{
  "schema": "kyc-regulations/v1",
  "jurisdiction": "fed_gulf",
  "jurisdictionName": "Federal Gulf of America Waters",
  "agency": "NOAA Fisheries SERO + Atlantic HMS Division",
  "authority": "50 CFR Part 622 (Subparts B, Q) and 50 CFR Part 635 (HMS)",
  "effectiveYear": 2026,
  "verifiedDate": "2026-05-15",
  "universalGearNote": "Gulf EEZ reef fish (DESCEND Act + circle-hook rule, 50 CFR 622.30/31): non-stainless non-offset circle hooks with natural bait; dehooking device required; venting tool OR descending device rigged and ready.",
  "rules": {
    "red_snapper":        { "open": "For-hire: Jun 1 – Oct 26, 2026 · Private anglers: follow your state season", "minSize": 16, "lengthType": "TL", "maxSize": null, "bagLimit": 2, "vesselLimit": null, "notes": "Federal for-hire component only; captain/crew bag = 0. Private angling delegated to the Gulf states (Reef Fish Amendment 50).", "verified": true, "confidence": "partial", "source": "https://www.fisheries.noaa.gov/bulletin/noaa-fisheries-announces-2026-gulf-america-red-snapper-recreational-federal-hire", "lastUpdated": "2026-05-15" },
    "vermilion_snapper":  { "open": "Year-round", "minSize": 10, "lengthType": "TL", "maxSize": null, "bagLimit": 10, "vesselLimit": null, "notes": "Sub-cap within the 20-fish reef-fish aggregate.", "verified": true, "confidence": "verified", "source": "https://www.ecfr.gov/current/title-50/chapter-VI/part-622/subpart-B/section-622.38", "lastUpdated": "2026-05-15" },
    "lane_snapper":       { "open": "Year-round", "minSize": 8, "lengthType": "TL", "maxSize": null, "bagLimit": null, "vesselLimit": null, "notes": "Within the 20-fish reef-fish aggregate; no individual sub-cap.", "verified": true, "confidence": "verified", "source": "https://www.ecfr.gov/current/title-50/chapter-VI/part-622/subpart-B/section-622.38", "lastUpdated": "2026-05-15" },
    "mangrove_snapper":   { "open": "Year-round", "minSize": 12, "lengthType": "TL", "maxSize": null, "bagLimit": null, "vesselLimit": null, "notes": "Within the 10-fish snapper aggregate; no individual sub-cap.", "verified": true, "confidence": "verified", "source": "https://www.ecfr.gov/current/title-50/chapter-VI/part-622/subpart-B/section-622.38", "lastUpdated": "2026-05-15" },
    "mutton_snapper":     { "open": "Year-round", "minSize": 18, "lengthType": "TL", "maxSize": null, "bagLimit": 5, "vesselLimit": null, "notes": "Sub-cap of 5 within the 10-fish snapper aggregate.", "verified": true, "confidence": "verified", "source": "https://www.ecfr.gov/current/title-50/chapter-VI/part-622/subpart-B/section-622.38", "lastUpdated": "2026-05-15" },
    "yellowtail_snapper": { "open": "Year-round", "minSize": 12, "lengthType": "TL", "maxSize": null, "bagLimit": null, "vesselLimit": null, "notes": "Within the 10-fish snapper aggregate; no individual sub-cap.", "verified": true, "confidence": "verified", "source": "https://www.ecfr.gov/current/title-50/chapter-VI/part-622/subpart-B/section-622.38", "lastUpdated": "2026-05-15" },
    "red_grouper":        { "open": "Year-round, except closed Feb 1 – Mar 31, 2026 seaward of the ~20-fathom contour", "minSize": 20, "lengthType": "TL", "maxSize": null, "bagLimit": 2, "vesselLimit": null, "notes": "Within the 4-fish grouper aggregate; max 2 red grouper/person/day; captain/crew bag = 0.", "verified": true, "confidence": "verified", "source": "https://www.fisheries.noaa.gov/southeast/rules-regulations/fishing-regulations-and-seasonal-closures-gulf-america", "lastUpdated": "2026-05-15" },
    "gag_grouper":        { "open": "Closed Jan 1 – Aug 31, 2026 (fall reopening pending)", "minSize": 24, "lengthType": "TL", "maxSize": null, "bagLimit": 2, "vesselLimit": null, "notes": "Within the 4-fish grouper aggregate; captain/crew bag = 0. 2026 fall opening dates not yet announced (2025 was Sep 1–15).", "verified": true, "confidence": "closure_confirmed_reopen_pending", "source": "https://www.fisheries.noaa.gov/southeast/rules-regulations/fishing-regulations-and-seasonal-closures-gulf-america", "lastUpdated": "2026-05-15" },
    "black_grouper":      { "open": "Year-round, except closed Feb 1 – Mar 31, 2026 seaward of the ~20-fathom contour", "minSize": 24, "lengthType": "TL", "maxSize": null, "bagLimit": null, "vesselLimit": null, "notes": "Within the 4-fish grouper aggregate; captain/crew bag = 0.", "verified": true, "confidence": "verified", "source": "https://www.fisheries.noaa.gov/southeast/rules-regulations/fishing-regulations-and-seasonal-closures-gulf-america", "lastUpdated": "2026-05-15" },
    "scamp":              { "open": "Year-round, except closed Feb 1 – Mar 31, 2026 seaward of the ~20-fathom contour", "minSize": 16, "lengthType": "TL", "maxSize": null, "bagLimit": null, "vesselLimit": null, "notes": "Within the 4-fish grouper aggregate (Other Shallow-Water Grouper complex); captain/crew bag = 0.", "verified": true, "confidence": "verified", "source": "https://www.fisheries.noaa.gov/southeast/rules-regulations/fishing-regulations-and-seasonal-closures-gulf-america", "lastUpdated": "2026-05-15" },
    "greater_amberjack":  { "open": "Closed Jan 1 – Aug 31, 2026; reopens Sep 1, 2026 (subject to in-season closure)", "minSize": 34, "lengthType": "FL", "maxSize": null, "bagLimit": 1, "vesselLimit": null, "notes": "Captain/crew bag = 0. 2025 in-season closure carried through Aug 31, 2026.", "verified": true, "confidence": "verified", "source": "https://www.fisheries.noaa.gov/bulletin/recreational-fishing-season-closure-greater-amberjack-federal-waters-gulf", "lastUpdated": "2026-05-15" },
    "lesser_amberjack":   { "open": "Year-round", "minSize": 14, "lengthType": "FL", "maxSize": 22, "bagLimit": 5, "vesselLimit": null, "notes": "Slot 14–22 in; 5-fish aggregate combined with banded rudderfish.", "verified": true, "confidence": "verified", "source": "https://www.ecfr.gov/current/title-50/chapter-VI/part-622/subpart-B/section-622.38", "lastUpdated": "2026-05-15" },
    "almaco_jack":        { "open": "Year-round", "minSize": null, "lengthType": null, "maxSize": null, "bagLimit": null, "vesselLimit": null, "notes": "Within the 20-fish reef-fish aggregate; no federal minimum size.", "verified": true, "confidence": "verified", "source": "https://www.ecfr.gov/current/title-50/chapter-VI/part-622/subpart-B/section-622.38", "lastUpdated": "2026-05-15" },
    "banded_rudderfish":  { "open": "Year-round", "minSize": 14, "lengthType": "FL", "maxSize": 22, "bagLimit": 5, "vesselLimit": null, "notes": "Slot 14–22 in; 5-fish aggregate combined with lesser amberjack.", "verified": true, "confidence": "verified", "source": "https://www.ecfr.gov/current/title-50/chapter-VI/part-622/subpart-B/section-622.38", "lastUpdated": "2026-05-15" },
    "spanish_mackerel":   { "open": "Year-round", "minSize": 12, "lengthType": "FL", "maxSize": null, "bagLimit": 15, "vesselLimit": null, "notes": "Gulf migratory group; fishing year Apr 1 – Mar 31; in-season accountability if ACL reached.", "verified": true, "confidence": "verified", "source": "https://www.ecfr.gov/current/title-50/chapter-VI/part-622/subpart-Q/section-622.382", "lastUpdated": "2026-05-15" },
    "king_mackerel":      { "open": "Year-round", "minSize": 24, "lengthType": "FL", "maxSize": null, "bagLimit": 3, "vesselLimit": null, "notes": "Gulf migratory group.", "verified": true, "confidence": "verified", "source": "https://www.ecfr.gov/current/title-50/chapter-VI/part-622/subpart-Q/section-622.382", "lastUpdated": "2026-05-15" },
    "cero_mackerel":      { "open": "Not federally managed in Gulf — follow state rules", "minSize": null, "lengthType": null, "maxSize": null, "bagLimit": null, "vesselLimit": null, "notes": "Removed from the federal Coastal Migratory Pelagics FMP (Amendment 18, 2012). State regulations apply in state waters.", "verified": false, "confidence": "not_managed", "source": "https://www.fisheries.noaa.gov/action/gulf-mexico-and-south-atlantic-coastal-migratory-pelagics-historical-amendments-and", "lastUpdated": "2026-05-15" },
    "yellowfin_tuna":     { "open": "Year-round", "minSize": 27, "lengthType": "CFL", "maxSize": null, "bagLimit": 3, "vesselLimit": null, "notes": "HMS Angling or Charter/Headboat permit required aboard. Cannot retain if a hammerhead or oceanic whitetip shark is on board.", "verified": true, "confidence": "verified", "source": "https://www.fisheries.noaa.gov/atlantic-highly-migratory-species/recreational-atlantic-bigeye-albacore-yellowfin-and-skipjack-tuna", "lastUpdated": "2026-05-15" },
    "blackfin_tuna":      { "open": "Not federally managed — follow state rules", "minSize": null, "lengthType": null, "maxSize": null, "bagLimit": null, "vesselLimit": null, "notes": "Not among federally managed Atlantic HMS species. State regulations may apply in state waters.", "verified": false, "confidence": "not_managed", "source": "https://www.fisheries.noaa.gov/atlantic-highly-migratory-species/atlantic-highly-migratory-species-fishery-statuses-minimum-sizes", "lastUpdated": "2026-05-15" },
    "blue_marlin":        { "open": "Year-round", "minSize": 99, "lengthType": "LJFL", "maxSize": null, "bagLimit": null, "vesselLimit": null, "notes": "No per-person/day limit; US-wide annual cap of 250 blue+white marlin + roundscale spearfish. HMS permit required; mandatory landing report within 24 hr via hmspermits.noaa.gov.", "verified": true, "confidence": "verified", "source": "https://www.fisheries.noaa.gov/atlantic-highly-migratory-species/recreational-atlantic-billfish-fishery-statuses-minimum-sizes-and", "lastUpdated": "2026-05-15" },